{"applicants":[{"age":35,"amount":6948,"checking":"A12","credit_history":"A32","duration":36,"employment":"A73","existing_credits":1,"housing":"A151","installment_rate":2,"row_1based":8,"savings":"A61","y_bad_observed":0},{"age":32,"amount":1282,"checking":"A11","credit_history":"A32","duration":24,"employment":"A73","existing_credits":1,"housing":"A152","installment_rate":4,"row_1based":16,"savings":"A62","y_bad_observed":1},{"age":44,"amount":12579,"checking":"A12","credit_history":"A32","duration":24,"employment":"A75","existing_credits":1,"housing":"A153","installment_rate":4,"row_1based":19,"savings":"A61","y_bad_observed":1},{"age":57,"amount":2225,"checking":"A12","credit_history":"A33","duration":36,"employment":"A75","existing_credits":2,"housing":"A153","installment_rate":4,"row_1based":55,"savings":"A61","y_bad_observed":1},{"age":61,"amount":1953,"checking":"A12","credit_history":"A30","duration":36,"employment":"A75","existing_credits":1,"housing":"A153","installment_rate":4,"row_1based":63,"savings":"A61","y_bad_observed":1},{"age":34,"amount":3965,"checking":"A11","credit_history":"A32","duration":42,"employment":"A72","existing_credits":1,"housing":"A152","installment_rate":4,"row_1based":77,"savings":"A61","y_bad_observed":1},{"age":45,"amount":339,"checking":"A11","credit_history":"A31","duration":12,"employment":"A75","existing_credits":1,"housing":"A152","installment_rate":4,"row_1based":158,"savings":"A61","y_bad_observed":0},{"age":33,"amount":1131,"checking":"A11","credit_history":"A32","duration":18,"employment":"A71","existing_credits":1,"housing":"A152","installment_rate":4,"row_1based":167,"savings":"A61","y_bad_observed":1}],"features":{"actionable":["duration","amount","installment_rate","checking","savings"],"candidates":{"amount_multiplier":[0.4,0.5,0.6,0.7,0.8,0.9,1.0],"checking":["A11","A12","A13","A14"],"duration":[6,9,12,15,18,24,30,36,42,48,60,72],"installment_rate":[1,2,3,4],"savings":["A61","A62","A63","A64","A65"]},"display":{"categories":{"checking":{"A11":"under 0 DM","A12":"0 to under 200 DM","A13":"200 DM or more (or salary assignment for a year or more)","A14":"no checking account"},"credit_history":{"A30":"no credits taken or all paid back duly","A31":"all credits at this bank paid back duly","A32":"existing credits paid back duly so far","A33":"delay in paying off in the past","A34":"critical account or credits elsewhere"},"employment":{"A71":"unemployed","A72":"under 1 year","A73":"1 to under 4 years","A74":"4 to under 7 years","A75":"7 years or more"},"housing":{"A151":"rent","A152":"own","A153":"for free"},"savings":{"A61":"under 100 DM","A62":"100 to under 500 DM","A63":"500 to under 1000 DM","A64":"1000 DM or more","A65":"unknown or no savings account"}},"features":{"age":"age (years)","amount":"credit amount (DM)","checking":"checking account","credit_history":"credit history","duration":"loan duration (months)","employment":"present employment","existing_credits":"existing credits at this bank","housing":"housing","installment_rate":"installment rate (% of disposable income)","log_amount":"credit amount (DM, log scale)","savings":"savings account or bonds"},"source":"UCI Statlog German Credit documentation (german.doc), plain-language wording"},"immutable":["age","credit_history","employment","housing","existing_credits"]},"generated_at":"2026-10-11T00:00:00Z","model":{"categories":{"checking":["A11","A12","A13","A14"],"credit_history":["A30","A31","A32","A33","A34"],"employment":["A71","A72","A73","A74","A75"],"housing":["A151","A152","A153"],"savings":["A61","A62","A63","A64","A65"]},"coef":[0.488715342522,0.187413473818,0.387363418186,-0.145366586239,-0.024842113862,0.729539092341,0.420391207188,-0.242295236262,-0.906743038988,0.459864582873,0.164554298218,-0.117897513027,-0.294007837489,-0.211621506296,0.177980815983,0.759755807094,-0.288341657531,-0.029516177964,-0.618986763302,0.271155465691,0.281714605261,0.204650865608,-0.808542807272,0.051913894991,0.135553295473,-0.183880212562,0.049218941369],"intercept":-0.907805690098,"names":["duration","log_amount","installment_rate","age","existing_credits","checking=A11","checking=A12","checking=A13","checking=A14","savings=A61","savings=A62","savings=A63","savings=A64","savings=A65","credit_history=A30","credit_history=A31","credit_history=A32","credit_history=A33","credit_history=A34","employment=A71","employment=A72","employment=A73","employment=A74","employment=A75","housing=A151","housing=A152","housing=A153"],"note":"log_amount = ln(amount); p_bad = sigmoid(intercept + sum coef*feature)","num_features":["duration","log_amount","installment_rate","age","existing_credits"],"num_mean":[20.876666666667,7.776209291034,2.983333333333,35.508333333333,1.398333333333],"num_sd":[12.072756750451,0.781107988545,1.105918421745,11.163031124605,0.553471368325],"test_auc":0.7235},"results":[{"row_1based":8,"targets":[{"base_p_bad":0.6395284693,"changes":{"savings":["A61","A63"]},"cost":1.0,"found":true,"n_changed":1,"p_bad_after":0.4988890169,"target":0.5},{"base_p_bad":0.6395284693,"changes":{"checking":["A12","A14"],"duration":[36,30],"savings":["A61","A64"]},"cost":2.4969867383,"found":true,"n_changed":3,"p_bad_after":0.1479748706,"target":0.1666666667}]},{"row_1based":16,"targets":[{"base_p_bad":0.5289805498,"changes":{"duration":[24,18]},"cost":0.4969867383,"found":true,"n_changed":1,"p_bad_after":0.4683342457,"target":0.5},{"base_p_bad":0.5289805498,"changes":{"checking":["A11","A14"],"duration":[24,18]},"cost":1.4969867383,"found":true,"n_changed":2,"p_bad_after":0.1464006495,"target":0.1666666667}]},{"row_1based":19,"targets":[{"base_p_bad":0.639737176,"changes":{"savings":["A61","A63"]},"cost":1.0,"found":true,"n_changed":1,"p_bad_after":0.4991153763,"target":0.5},{"base_p_bad":0.639737176,"changes":{"checking":["A12","A14"],"duration":[24,18],"savings":["A61","A64"]},"cost":2.4969867383,"found":true,"n_changed":3,"p_bad_after":0.1480890636,"target":0.1666666667}]},{"row_1based":55,"targets":[{"base_p_bad":0.6657484806,"changes":{"savings":["A61","A64"]},"cost":1.0,"found":true,"n_changed":1,"p_bad_after":0.4837921206,"target":0.5},{"base_p_bad":0.6657484806,"changes":{"checking":["A12","A14"],"duration":[36,30],"savings":["A61","A64"]},"cost":2.4969867383,"found":true,"n_changed":3,"p_bad_after":0.1631638298,"target":0.1666666667}]},{"row_1based":63,"targets":[{"base_p_bad":0.70224804,"changes":{"checking":["A12","A14"]},"cost":1.0,"found":true,"n_changed":1,"p_bad_after":0.384827304,"target":0.5},{"base_p_bad":0.70224804,"changes":{"checking":["A12","A14"],"duration":[36,24],"savings":["A61","A64"]},"cost":2.9939734767,"found":true,"n_changed":3,"p_bad_after":0.1533258038,"target":0.1666666667}]},{"row_1based":77,"targets":[{"base_p_bad":0.8118294606,"changes":{"checking":["A11","A14"]},"cost":1.0,"found":true,"n_changed":1,"p_bad_after":0.4565249333,"target":0.5},{"base_p_bad":0.8118294606,"changes":{"checking":["A11","A14"],"duration":[42,24],"savings":["A61","A64"]},"cost":3.490960215,"found":true,"n_changed":3,"p_bad_after":0.16018287,"target":0.1666666667}]},{"row_1based":158,"targets":[{"base_p_bad":0.5823704711,"changes":{"installment_rate":[4,3]},"cost":0.9042258275,"found":true,"n_changed":1,"p_bad_after":0.4955621268,"target":0.5},{"base_p_bad":0.5823704711,"changes":{"checking":["A11","A14"],"installment_rate":[4,3]},"cost":1.9042258275,"found":true,"n_changed":2,"p_bad_after":0.1605644758,"target":0.1666666667}]},{"row_1based":167,"targets":[{"base_p_bad":0.5478262801,"changes":{"duration":[18,12]},"cost":0.4969867383,"found":true,"n_changed":1,"p_bad_after":0.4872544476,"target":0.5},{"base_p_bad":0.5478262801,"changes":{"checking":["A11","A14"],"duration":[18,12]},"cost":1.4969867383,"found":true,"n_changed":2,"p_bad_after":0.1561344893,"target":0.1666666667}]}],"schema_version":"v1","spec":{"search":"exhaustive grid, analytics/counterfactual.py docstring","share_found":1.0,"statement":"MODEL counterfactuals: the smallest input change that flips this fitted model's output. NOT causal; changing a feature in the real world need not change the outcome.","targets":"0.5 (default decision) and 1/6 (cost-optimal threshold from module 6)"},"tags":{"applicants":"OBSERVED","model":"PREDICTED","results":"PREDICTED"},"tolerance":{"abs":1e-09,"note":"p_bad values; changes must match exactly","rel":1e-09}}